{
  "trace_schema_version": 1,
  "trace_id": "trc_phase13_rust",
  "run_id": "run_phase13_rust",
  "agent": {
    "name": "claims-triage",
    "version": "0.1.0"
  },
  "mode": "guard",
  "language": "rust",
  "runtime_version": "rust-stable",
  "sdk_version": "0.1.0-beta.1",
  "created_at": "2026-06-23T19:00:00Z",
  "spans": [
    {
      "span_id": "spn_phase13_rust_crm",
      "parent_span_id": null,
      "component_type": "tool_call",
      "component_name": "crm.upsert_account",
      "start_time": "2026-06-23T19:00:01Z",
      "end_time": "2026-06-23T19:00:02Z",
      "status": "redacted",
      "payload_size_bytes": 1400,
      "token_count": null,
      "content_hash": "sha256:4343434343434343434343434343434343434343434343434343434343434343",
      "data_classes": [
        "account_notes",
        "email"
      ],
      "destination_id": "crm",
      "policy_decision": {
        "action": "redact",
        "reason": "destination redaction rule matched",
        "policy_version": 1,
        "fields": [
          "account_notes",
          "email"
        ]
      },
      "error_summary": null,
      "redaction_markers": [
        "redact:account_notes",
        "redact:email"
      ]
    }
  ],
  "destinations": [
    {
      "id": "crm",
      "type": "external_tool",
      "domain": "api.crm.example",
      "provider": "Example CRM",
      "environment": "production",
      "risk": "high",
      "declared_in_policy": true,
      "allowed_data_classes": [
        "account_id",
        "support_tier"
      ],
      "observed_data_classes": [
        "account_notes",
        "email"
      ]
    }
  ]
}
