{
  "trace_schema_version": 1,
  "trace_id": "trc_high_risk_001",
  "run_id": "run_high_risk_001",
  "agent": {
    "name": "claims-triage",
    "version": "0.1.0"
  },
  "mode": "guard",
  "language": "python",
  "runtime_version": "3.10.14",
  "sdk_version": "0.1.0",
  "created_at": "2026-06-23T18:20:00Z",
  "spans": [
    {
      "span_id": "spn_blocked_ocr",
      "parent_span_id": null,
      "component_type": "tool_call",
      "component_name": "external_ocr.extract",
      "start_time": "2026-06-23T18:20:01Z",
      "end_time": "2026-06-23T18:20:01Z",
      "status": "blocked",
      "payload_size_bytes": 4096,
      "token_count": null,
      "content_hash": "sha256:3333333333333333333333333333333333333333333333333333333333333333",
      "data_classes": [
        "medical_information",
        "document_text"
      ],
      "destination_id": "external_ocr",
      "policy_decision": {
        "action": "block",
        "reason": "undeclared high-risk egress",
        "policy_version": 1,
        "fields": [
          "medical_information",
          "document_text"
        ]
      },
      "error_summary": null,
      "redaction_markers": [
        "hashed:document_text",
        "redacted:medical_information"
      ]
    }
  ],
  "destinations": [
    {
      "id": "external_ocr",
      "type": "external_tool",
      "domain": "api.ocr.example",
      "provider": "Example OCR",
      "environment": "production",
      "risk": "high",
      "declared_in_policy": false,
      "allowed_data_classes": [],
      "observed_data_classes": [
        "medical_information",
        "document_text"
      ]
    }
  ]
}
