{
  "trace_schema_version": 1,
  "trace_id": "trc_tool_sensitive_001",
  "run_id": "run_tool_sensitive_001",
  "agent": {
    "name": "claims-triage",
    "version": "0.1.0"
  },
  "mode": "observe",
  "language": "python",
  "runtime_version": "3.10.14",
  "sdk_version": "0.1.0",
  "created_at": "2026-06-23T18:10:00Z",
  "spans": [
    {
      "span_id": "spn_crm_tool",
      "parent_span_id": null,
      "component_type": "tool_call",
      "component_name": "crm.upsert_account",
      "start_time": "2026-06-23T18:10:01Z",
      "end_time": "2026-06-23T18:10:02Z",
      "status": "redacted",
      "payload_size_bytes": 1400,
      "token_count": null,
      "content_hash": "sha256:1111111111111111111111111111111111111111111111111111111111111111",
      "data_classes": [
        "email",
        "account_notes"
      ],
      "destination_id": "crm",
      "policy_decision": {
        "action": "redact",
        "reason": "destination requires redaction for email and account notes",
        "policy_version": 1,
        "fields": [
          "email",
          "account_notes"
        ]
      },
      "error_summary": null,
      "redaction_markers": [
        "redacted:email",
        "redacted:account_notes"
      ]
    }
  ],
  "destinations": [
    {
      "id": "crm",
      "type": "external_tool",
      "domain": "api.crm.example",
      "provider": "Example CRM",
      "environment": "production",
      "risk": "high",
      "declared_in_policy": true,
      "allowed_data_classes": [
        "account_id",
        "support_tier"
      ],
      "observed_data_classes": [
        "email",
        "account_notes"
      ]
    }
  ]
}
