{
  "trace_schema_version": 1,
  "trace_id": "trc_new_crm_001",
  "run_id": "run_new_crm_001",
  "agent": {
    "name": "claims-triage",
    "version": "0.1.0"
  },
  "mode": "observe",
  "language": "python",
  "runtime_version": "3.10.14",
  "sdk_version": "0.1.0",
  "created_at": "2026-06-23T18:15:00Z",
  "spans": [
    {
      "span_id": "spn_new_crm_tool",
      "parent_span_id": null,
      "component_type": "tool_call",
      "component_name": "crm.create_contact",
      "start_time": "2026-06-23T18:15:01Z",
      "end_time": "2026-06-23T18:15:02Z",
      "status": "ok",
      "payload_size_bytes": 980,
      "token_count": null,
      "content_hash": "sha256:2222222222222222222222222222222222222222222222222222222222222222",
      "data_classes": [
        "email",
        "account_notes"
      ],
      "destination_id": "crm",
      "policy_decision": {
        "action": "warn",
        "reason": "observe_only: undeclared destination",
        "policy_version": 1,
        "fields": [
          "email",
          "account_notes"
        ]
      },
      "error_summary": null,
      "redaction_markers": [
        "hashed:email",
        "hashed:account_notes"
      ]
    }
  ],
  "destinations": [
    {
      "id": "crm",
      "type": "external_tool",
      "domain": "api.crm.example",
      "provider": "Example CRM",
      "environment": "production",
      "risk": "high",
      "declared_in_policy": false,
      "allowed_data_classes": [],
      "observed_data_classes": [
        "email",
        "account_notes"
      ]
    }
  ]
}
